,fname,text
35,chl.de about,"chl.de about.   About | Dr. Edgar Treischl Nice to meet you, I’m Edgar.  Until recently I worked as a postdoctoral research assistant at the Chair of Empirical Economic Sociology, at the University Erlangen-Nürnberg. I studied sociology at the University of Munich, where I graduated in 2013 with a degree in Sociology, focusing on quantitative methods and educational research. I attained my PhD at the University of Mannheim as a part of the Graduate School of Economic and Social Sciences (GESS). Between 2013 and 2015 I worked at the University of Munich as a research assistant at Norman Braun’s chair of quantitative social research (now Katrin Auspurg), where I was also responsible for the quality management and teaching evaluation as a member of the dean of studies Josef Brüderl. Before I went to Nuremberg, I worked as research assistant at the Chair Statistics and Methodology (Frauke Kreuter and Florian Keusch) and as project team member (Tobias Wolbring) at the Mannheim Centre for European Social Research (MZES). Download my CV for more information Private information about Edgar: - How old is Edgar? Edgar is born in 1984. - Edgar is married. - Edgar has pets: Two cats named Tom and Fritz. - Edgar second name is: Josef. - At the moment Edgar lives in Nuremberg. - Edgar favourite meal: Edgar loves Spanish food, especially tapas like Empanada, Croquetas de pollo, and tortilla. - Edgar's music taste: Edgar listens to all kinds of music, such as pop or rock music, but he also likes hip hop, soul, blues, or reggaeton. Information about EdgarGTP: - EdgarGTP is an AI chatbot based on the text-embedding-ada-002 model from openai. - It has learned facts about Edgar Treischl based on his website, his CV, and further projects texts such as his research articles, books, and teaching material. - EdgarGTP is supposed to answer questions about Edgar.   "
36,chl.de project statameetsr,"chl.de project statameetsr.   Stata meets R | Dr. Edgar Treischl        About Projects Publications Snippets Visualizations Contact  Stata meets R November 1, 2020 Website The workshop introduces R for Stata Users and shows the first steps to analyze data. Posted on: November 1, 2020 Length: 1 minute read, 15 words See Also:  ← Stata And Paste Workshops empirische Bildungsforschung →    © 2023 Edgar Treischl    Made with Hugo Apéro.    Based on Blogophonic by Formspree.      License   "
37,chl.de project olsapp,"chl.de project olsapp.   Linear Regression App | Dr. Edgar Treischl  Linear Regression App in R Shiny R The apps shows user with little statistical background the main idea of a linear regression analysis. User can pick data and variables to estimate an effect on different outcomes. Posted on: November 1, 2020 Length: 1 minute read, 29 words Categories: R Shiny R See Also:  ← Empirical educational research Logistic regression app →    © 2023 Edgar Treischl    Made with Hugo Apéro.    Based on Blogophonic by Formspree.      License   "
38,chl.de publication wirkungsevaluation,"chl.de publication wirkungsevaluation.   Book: Wirkungsevaluation | by Edgar Treischl and Tobias Wolbring  Title: Wirkungsevaluation Grundlagen, Standards, Beispiele Summary: Evaluationen werden häufig durchgeführt, um die kausalen Wirkungen einer Maßnahme zu identifizieren. Das Lehrbuch führt in die entsprechenden theoretischen und methodischen Grundlagen der Wirkungsevaluation ein und illustriert diese anhand ausgewählter Beispiele. Ziel des Buches ist es dabei, einen praktischen Bezug zum Ablauf einer Evaluation und den einzelnen Entscheidungsschritten herzustellen, aber auch mögliche Fallstricke unterschiedlicher Evaluationsverfahren aufzuzeigen. Eine Lektüre ist daher sowohl für Evaluationsforschende als auch für Stakeholder wie Auftraggebende, Evaluierte und Entscheidungsträger ertragreich. Cite this book: Treischl, E. & Wolbring, T. (2020): Wirkungsevaluation. Grundlagen, Standards, Beispiele. Weinheim Basel: Beltz Juventa (Standards standardisierter und nichtstandardisierter Sozialforschung). "
39,chl.de dataviz streetmaps,"chl.de dataviz streetmaps.   Streetmap | Dr. Edgar Treischl        About Projects Publications Snippets Visualizations Contact  Streetmap GitHub  Posted on: October 14, 2021 Length: 0 minute read, 0 words See Also:  ← Illustrations Visualizations for Practice R →    © 2023 Edgar Treischl    Made with Hugo Apéro.    Based on Blogophonic by Formspree.      License   "
40,chl.de dataviz practicer,"chl.de dataviz practicer.   Visualizations for Practice R | Dr. Edgar Treischl        About Projects Publications Snippets Visualizations Contact  Visualizations for Practice R Website buy Practice R includes a lot of graphs and illustrations. Cite this book: Treischl, E. (2023): Practice R. Berlin/Boston: De Gruyter Oldenbourg. Posted on: October 14, 2021 Length: 1 minute read, 21 words See Also:  ← Streetmap Visualizations for Impact Evaluation →    © 2023 Edgar Treischl    Made with Hugo Apéro.    Based on Blogophonic by Formspree.      License   "
41,chl.de blog pythoneer1,"chl.de blog pythoneer1.   The PythoneeR: Intro | Dr. Edgar Treischl        About Projects Publications Snippets Visualizations Contact  The PythoneeR: Intro By Edgar Treischl in Python March 21, 2021 I tried to learn Python several times. Once I had a very peculiar class in which we should learn Python for processing natural language. Well, it was more about text mining than applying Python. I tried to learn Python with the help of several books which introduced and ins and out of Python. Before I started to learn Python, I fluently spoke several other statistics software like R, Stata, and please forgive me, my personal journey started with SPSS. To reestablish my reputation, I did not used SPSS for a hundered years and most of time I work with R. Anyway, what I am trying to say is that I was very familiar with statistical software programing. I had basic skills in other languages like HTML, CSS, JavaScript. I wrote my PhD with LaTeX. With all of this background, I still failed to learn Python. It is a shame, don’t you think? It is really a shame, since I consider myself a tech-savvy without having the heavy programing background, but with a lot of fun learning new things and enjoy coding. Well, at least, if we get some results. For this reason I started this block. I was sick of reading books about Python without having the impression that I learn what I should learn to improve my skills. This impression could also be due to my educational background. I know what a function is, what a loop does, and have some background in statistics, even though the latter is limited since I am home in the social sciences. Anyway, this blog is the results of many disappointing books with many pages that could not explain what I was seeking. If you want to learn Python to automate processes, learn some statistical procedures from the scratch, or use Python to program some games, this block will not help you in any way. However, you do wanna transfer your knowledge from other languages like R, if you are familiar with multivarite (non-) linear regression techniques or do you have background in empirical social science, than this blog might help you transfer your knowledge to Python. Let be give you an example why I started this blog. Hopefully, this illustrates my point and gives you some guidance whether its worth following this blog or if I am just another weirdo. How (not) to calculate some basic statistics in Python  The last Python book I read, introduced probably over a hunderd pages about the different data structure, and of course, we need to know that to handle Python. I certainly don’t argue about this point, but instead of providing me meaningful examples to illstrate this point, I am reading about about articifical examples that not even work when I copied the code and run it in my own console. Well, shit happens, don’t you think? I really started to get the creep as I reached a statistics section. Let’s see what I learned from this chapter. In Python, you have to import the according libraries and install first, in case you work with a library the very first time. We will cover these points later, for the moment it is enough to look at the Python code and output. So, I import the seaborn package in order to have some data at hand. We can save the mpg data under the name cars and use the print function to see a bit of the data. #import seaborn to get some data import seaborn as sns cars = sns.load_dataset(""mpg"") print(cars) ##  mpg cylinders ... origin      name ## 0 18.0   8 ...  usa chevrolet chevelle malibu ## 1 15.0   8 ...  usa   buick skylark 320 ## 2 18.0   8 ...  usa   plymouth satellite ## 3 16.0   8 ...  usa    amc rebel sst ## 4 17.0   8 ...  usa    ford torino ## .. ...  ... ...  ...      ... ## 393 27.0   4 ...  usa   ford mustang gl ## 394 44.0   4 ... europe     vw pickup ## 395 32.0   4 ...  usa    dodge rampage ## 396 28.0   4 ...  usa    ford ranger ## 397 31.0   4 ...  usa     chevy s-10 ## ## [398 rows x 9 columns] So, what did I learn in the chapter? Well, how can we calculate an mean with Python? Shouldn’t be that though. I know how to calculate a mean by hand since my early days of school and how it is done in a statistic software. The authors offered me the following solution: def mean (array):  n = len(array)  return sum(array) / n mean(cars.mpg) ## 23.514572864321615 In the code snippet we define the function mean to create a mean, within this function we define n as the length(len) of the array and the functions returns a value, which divides the sum of the array by the length n. Fine. That’s exactly a cool way to show us how a functions works. We have to provide a name of a function, tell Python what the function should do, in this case with an array of numbers. In my experience, I always learned how functions and other concepts work in much more artifical way. Look how I learned what a function in Python does: #Create your now function def hello(name):  return (f""Hallo, {name}! How are you?"") # Call the function and give value for the input name hello(""Edgar"") ## 'Hallo, Edgar! How are you?' Thus, we create the hello function that returns a sentence and inserts the name of the input value. Nothing worng about that, even though calculating a mean seems a little bit more realistic to illustrate why one needs such a function. Anyway, in the next steps the author gives us a function for the mean, a function for the median, a function for the modus, a function to calculate the variance and, I am dead serious, other functions for others measure of central tendency. Come on, this guy can’t be serious, we should learn how this works in practice. Use NumPy to get the scientific toolkit and pandas for tabular processing and the presentation of data. The latter comes with a lot of functions we can use them in order to calcuate basic statistics and more advanced stuff. Use the describe function to get an overview about the data. Let’s see how it works. import numpy as np import pandas as pd cars.describe() ##    mpg cylinders ... acceleration model_year ## count 398.000000 398.000000 ... 398.000000 398.000000 ## mean 23.514573 5.454774 ...  15.568090 76.010050 ## std  7.815984 1.701004 ...  2.757689 3.697627 ## min  9.000000 3.000000 ...  8.000000 70.000000 ## 25%  17.500000 4.000000 ...  13.825000 73.000000 ## 50%  23.000000 4.000000 ...  15.500000 76.000000 ## 75%  29.000000 8.000000 ...  17.175000 79.000000 ## max  46.600000 8.000000 ...  24.800000 82.000000 ## ## [8 rows x 7 columns] So, we have to append the describe() function to the saved cars data in order to get an overview of the central tendency measures. You can do the same with all other functions that calculate other measures, such as the mean or standard deviance: cars.mean() ## mpg    23.514573 ## cylinders   5.454774 ## displacement  193.425879 ## horsepower  104.469388 ## weight   2970.424623 ## acceleration  15.568090 ## model_year  76.010050 ## dtype: float64 ## ## <string>:1: FutureWarning: The default value of numeric_only in DataFrame.mean is deprecated. In a future version, it will default to False. In addition, specifying 'numeric_only=None' is deprecated. Select only valid columns or specify the value of numeric_only to silence this warning. cars.std() ## mpg    7.815984 ## cylinders   1.701004 ## displacement 104.269838 ## horsepower  38.491160 ## weight   846.841774 ## acceleration  2.757689 ## model_year  3.697627 ## dtype: float64 ## ## <string>:1: FutureWarning: The default value of numeric_only in DataFrame.std is deprecated. In a future version, it will default to False. In addition, specifying 'numeric_only=None' is deprecated. Select only valid columns or specify the value of numeric_only to silence this warning. So, what you do think? Shall we learn how to define our own function to calculate the mean or choose the easy way and let a package calcuate the “hard” stuff for us. I would say both. We learned on this entry how to write an own function by solving a real-world problem. In case we didn’t know how to calculate a mean in Python we could use a function and I provided you on purpose with a second example to show you how many others explain a function. However, after learning what a function is, we need to know how we could work and spent our time more efficiently. This point becomes bothersome if we spent too much of our time with things that have a simple solution. For instance, guess what the next code does. And I guess you will skip the code after line 2, well that’s at least what recommend if you know what a correlation is. import math def correlation(x, y):  n = len(x)   # Means  x_mn = sum(x) / n  y_mn = sum(y) / n   # Variance  var_x = (1 / (n-1)) * sum(map(lambda xi: (xi - x_mn) ** 2 , x))  var_y = (1 / (n-1)) * sum(map(lambda yi: (yi - y_mn) ** 2 , y))   # Std  std_x, std_y = math.sqrt(var_x), math.sqrt(var_y)   # Covariance  xy_var = map(lambda xi, yi: (xi - x_mn) * (yi - y_mn), x, y)  cov = (1 / (n-1)) * sum(xy_var)   # Pearson's R  r = cov / (std_x * std_y)  return float(f""{r:.3f}"") # Some data size = [20, 15, 40, 25, 35] cost = [300, 400, 600, 700, 666] print(correlation(size, cost)) ## 0.666 It’s the “devil’s code”! Of course, I am just kidding, but please don’t get me wrong. I think it is very useful to see how a correlation coefficients is calculated. You should do it at least once per hand if you learn the concept for the first time. But in my case I don’t have to learn what a correlation is. Let’s learn how Python works, but in the “edgar-bad-ass” way: np.corrcoef(size, cost) ## array([[1.  , 0.66645893], ##  [0.66645893, 1.  ]]) And we should at least look at the scatter plot in case we talk about correlations. The matplotlib provides a lot of different graphs for us. import matplotlib import matplotlib.pyplot as plt matplotlib.style.use('ggplot') plt.scatter(cars.mpg, cars.horsepower) And in case you are an R user, you can even use the ggplot2 style, just to let you show some possibilities. But of course, we have to think more systematically how we can reach our goal the next time. Posted on: March 21, 2021 Length: 9 minute read, 1733 words Categories: Python See Also:  ← Learning SQL the Badass Way II Learning SQL the Badass Way (1) →     © 2023 Edgar Treischl    Made with Hugo Apéro.    Based on Blogophonic by Formspree.      License   "
42,chl.de blog sql1,"chl.de blog sql1.   Learning SQL the Badass Way (1) | Dr. Edgar Treischl        About Projects Publications Snippets Visualizations Contact  Learning SQL the Badass Way (1) By Edgar Treischl in SQL March 12, 2020 The blog learning SQL the badass way shows you the basic commands to manage tables and data with SQL. I assume that you are familiar with R (or other programming languages) to manipulate data. For this reason, this page only summarizes main idiosyncrasies of SQL, not concepts that you probably know from any other programming experience. I made the experience that learning new things always takes a lot of time and often I have the impression that many courses are designed without taking your personal experience into account. What a surprise, I can read and write some SQL code even I have no idea what SQL does and I guess you can too! This blog is the result of this experience and gives a quick and dirty introduction, assuming that you have some previous coding experience and I do not have to explain why we want to wrangle data in the first place. If you do not have this impression or if you want to learn SQL in a proper way, close this blog. Go and find your way to a real SQL course or some other resources. However, if you are bored from long introduction what data is, why we need to learn how to wrangle data or other common aspects that come along the data science journey, feel free to join my SQL journey. The biggest mistake trying to learn SQL first. If you ever opened a book that introduces SQL (or any other programming language) to will find several chapters that outline you what SQL (structured query language) is. An explanation from the Wikipedia page should be sufficient: “SQL a domain-specific language used in programming and designed for managing data held in a relational database management system (RDBMS), or for stream processing in a relational data stream management system (RDSMS)”. Thus, in a nutshell we can remember that SQL is a language to manage data (tables) in databases. The next chapters shows you how to setup the corresponding software and the database. I’ll not do that in this blog because setting up a database on your own computer does not make much sense because there are easier ways for the first steps in SQL especially if you are a R user. In case you do not have access to a SQL database: This page was built with RMarkdown and includes some SQL snippets with the DBI package. All you have to do is install the package, setup the connection and include your SQL code directly in your RMarkdown document or your R script. Thus, in our case there is no database installed, we can make use of the the local memory to simulate a database, save a table (data frame) and run SQL commands directly as a code chunk via our R script. Checkout the databases page from RStudio for more information. Furthermore, I hope you are familiar with the mtcars and the iris data if you want to reproduce these first SQL steps. Both are implemented in R, but it does not matter if you not familiar with these data sets. I picked them because a lot of people know them and this blog shows you the first basic SQL commands how retrieve and work with data. Select   Use select to retrieve a table or a column from a table You can select a single column from a table Or select the entire table (data frame) with the wildcard * SELECT * FROM mtcars; Table: Table 1: Displaying records 1 - 10 mpg cyl disp hp drat wt qsec vs am gear carb  21.0 6 160.0 110 3.90 2.620 16.46 0 1 4 4 21.0 6 160.0 110 3.90 2.875 17.02 0 1 4 4 22.8 4 108.0 93 3.85 2.320 18.61 1 1 4 1 21.4 6 258.0 110 3.08 3.215 19.44 1 0 3 1 18.7 8 360.0 175 3.15 3.440 17.02 0 0 3 2 18.1 6 225.0 105 2.76 3.460 20.22 1 0 3 1 14.3 8 360.0 245 3.21 3.570 15.84 0 0 3 4 24.4 4 146.7 62 3.69 3.190 20.00 1 0 4 2 22.8 4 140.8 95 3.92 3.150 22.90 1 0 4 2 19.2 6 167.6 123 3.92 3.440 18.30 1 0 4 4  Limit the output by providing the number of lines SELECT mpg, disp FROM mtcars LIMIT 5; Table: Table 2: 5 records mpg disp  21.0 160 21.0 160 22.8 108 21.4 258 18.7 360  You can also insert a starting point that skips some observations. For instance, OFFSET 10 will skip the first ten table entries You must use quotations marks if the column contains special characters (like 'Petal.Width' from iris data) Where   Define what you want to select with the Where option (SQL folks say clause) For instance, the variable am is a binary indicator (0/1) and you can use where to select data only if am = 0 SELECT * FROM mtcars WHERE am = 0 LIMIT 5; Table: Table 3: 5 records mpg cyl disp hp drat wt qsec vs am gear carb  21.4 6 258.0 110 3.08 3.215 19.44 1 0 3 1 18.7 8 360.0 175 3.15 3.440 17.02 0 0 3 2 18.1 6 225.0 105 2.76 3.460 20.22 1 0 3 1 14.3 8 360.0 245 3.21 3.570 15.84 0 0 3 4 24.4 4 146.7 62 3.69 3.190 20.00 1 0 4 2  Remember to use quotation marks if you try to use where with non-numerical values from: e.g. != 'label' SELECT * FROM iris WHERE Species = ""virginica"" LIMIT 5; Table: Table 4: 5 records Sepal.Length Sepal.Width Petal.Length Petal.Width Species  6.3 3.3 6.0 2.5 virginica 5.8 2.7 5.1 1.9 virginica 7.1 3.0 5.9 2.1 virginica 6.3 2.9 5.6 1.8 virginica 6.5 3.0 5.8 2.2 virginica  Count   Count counts cases! SELECT COUNT(*) FROM mtcars; Table: Table 5: 1 records COUNT(*)  32  We can count subgroups with the WHERE clause: SELECT COUNT(am) FROM mtcars WHERE am != 0; Table: Table 6: 1 records COUNT(am)  13  DISTINCT   Distinct can be used to find distinct values. For instance, there are three different Species in the iris data, and distinct helps you to distract them: SELECT DISTINCT Species FROM iris Table: Table 7: 3 records Species  setosa versicolor virginica  As in other programming languages, we can combine several commands. For instance, we can COUNT how many Distinct species the iris data has: SELECT COUNT (DISTINCT Species) FROM iris Table: Table 8: 1 records COUNT (DISTINCT Species)  3  Insert Values   Next, I use a small data set (df) to illustrate how to insert values, make updates, and delete cases My toy data set df has two observations with three variables: x,y,z Never mind if you do not know what a tribble is, it is just a command to create data library(tidyverse) df <- tribble( ~x, ~y, ~z, ""a"", 2, 3.6, ""b"", 1, 8.5 ) df ## # A tibble: 2 × 3 ## x   y  z ## <chr> <dbl> <dbl> ## 1 a   2 3.6 ## 2 b   1 8.5 Now, we can insert new values into df by providing a list of the columns you want to fill in with values for each column: INSERT INTO df (x, y, z) VALUES('c', 3, 1); Let’s see whether it worked: SELECT * FROM df; Table: Table 9: 3 records x y z  a 2 3.6 b 1 8.5 c 3 1.0  Updates   Make updates for single (or multiple) values For instance, we can update the variable z and set z = 77 for a certain level of another variable: UPDATE df SET z = 77 WHERE x ='b'; Take care, without the WHERE clause all observation would get the new value! SELECT * FROM df; Table: Table 10: 3 records x y z  a 2 3.6 b 1 77.0 c 3 1.0  Delete   We can drop or delete observations, but of course we should take care since we probably do not want to delete the entire table, just for some implausible values For this reason we use the WHERE clause again, for instance, to get rid of second row of the toy data set: DELETE from df WHERE x = 'b'; SELECT * FROM df; Table: Table 11: 2 records x y z  a 2 3.6 c 3 1.0  In summary, in SQL we have to select a table from the database, specify conditions with the where clause. We can use count and distinct to get a first impression of the data. Furthermore, it is all about table. Sometimes we have to insert values, a really vague concept if you are use to work with data, but from a SQL you give your database a update, you are really right in front of the data or imagine that stream of new data needs an update. If that something you have to get used to it, don’t be afraid, me too. Posted on: March 12, 2020 Length: 7 minute read, 1478 words Categories: SQL See Also:  ← The PythoneeR: Intro GGplot for Starters →     © 2023 Edgar Treischl    Made with Hugo Apéro.    Based on Blogophonic by Formspree.      License   "
